SubjectID,StimID,Phase,svg_z,svg_obs,svg_null_mean,svg_null_std,n_transitions,n_relational,low_n,mean_salience_relational,mean_salience_nonrelational,n_relational_fixations,n_nonrelational_fixations,n_fixations,n_aoi,aoi_prop,mean_salience,enc_q1_accuracy,enc_q1_rt_ms,enc_q1_response,enc_q1_correct_key,enc_q1_question,enc_q2_accuracy,enc_q2_rt_ms,enc_q2_response,enc_q2_correct_key,enc_q2_question,enc_trial_index,enc_total_correct,dec_free_response,dec_rt_ms,dec_trial_index,dec_cue_question
Encode-Decode_Experiment-1-1,2371471,encoding,2.189755,0.6,0.36176,0.108798,25,15,False,0.319333,0.381878,29,5,34,34,1.0,0.32853,1.0,7851.0,3.0,3.0,What is nearest to the motorcyclists?,1.0,12421.0,2.0,2.0,What stunt is one motorcyclist performing?,1.0,2.0,,,,
Encode-Decode_Experiment-1-1,2387122,encoding,-0.330065,0.347826,0.387522,0.120266,23,8,False,0.316857,0.346243,16,13,33,29,0.8788,0.308556,1.0,7463.0,1.0,1.0,What is the polar bear doing next to the enclosure edge?,1.0,5668.0,3.0,3.0,Where is the polar bear located in the scene?,2.0,2.0,,,,
Encode-Decode_Experiment-1-1,2374670,encoding,-0.476733,0.3,0.35995,0.125752,20,6,False,0.196744,0.192463,22,14,39,36,0.9231,0.212175,0.0,6044.0,4.0,1.0,What vehicle sprays water in the scene?,1.0,9310.0,3.0,3.0,Where is the man standing relative to the vehicle?,3.0,1.0,,,,
Encode-Decode_Experiment-1-1,2356991,encoding,2.017518,0.321429,0.158786,0.080615,28,9,False,0.148569,0.176891,13,20,37,33,0.8919,0.161358,1.0,10953.0,1.0,1.0,How is the player on the left (from your perspective) reaching the base?,1.0,6687.0,2.0,2.0,What is the current action of the gloved player on the base?,4.0,2.0,,,,
Encode-Decode_Experiment-1-1,2412687,encoding,2.830765,0.666667,0.3048,0.127834,15,10,False,0.144164,0.08408,17,9,29,26,0.8966,0.127853,1.0,9147.0,3.0,3.0,What is the human's body position?,1.0,5930.0,4.0,4.0,What is the dog biting onto in the scene?,5.0,2.0,,,,
Encode-Decode_Experiment-1-1,2360001,encoding,-0.770094,0.041667,0.092708,0.06628,24,1,False,0.315042,0.283575,2,35,38,37,0.9737,0.279301,1.0,11249.0,4.0,4.0,What are the workers doing to the clock?,1.0,4944.0,4.0,4.0,Where are the men standing?,6.0,2.0,,,,
Encode-Decode_Experiment-1-1,2397102,encoding,3.190341,0.571429,0.227286,0.10787,21,12,False,0.137035,0.164877,24,11,35,35,1.0,0.145785,1.0,4439.0,1.0,1.0,What are the couple doing with the cake?,1.0,4350.0,3.0,3.0,What is the man holding besides the cake knife?,7.0,2.0,,,,
Encode-Decode_Experiment-1-1,150472,encoding,1.668758,0.35,0.19075,0.09543,20,7,False,0.0896,0.086865,13,17,30,30,1.0,0.08805,1.0,3118.0,4.0,4.0,How many women are in the scene?,1.0,3643.0,2.0,2.0,Where is the pizza slice located?,8.0,2.0,,,,
Encode-Decode_Experiment-1-1,2379478,encoding,3.182431,0.866667,0.396667,0.147686,15,13,False,0.395444,,34,0,35,34,0.9714,0.406243,1.0,4689.0,4.0,4.0,What is the position of the babies?,1.0,2082.0,2.0,2.0,How many babies are visible in the scene?,9.0,2.0,,,,
Encode-Decode_Experiment-1-1,2369373,encoding,1.123483,0.6,0.46848,0.117064,25,15,False,0.238755,0.215394,30,10,40,40,1.0,0.232915,1.0,6485.0,3.0,3.0,What tool is the chef using?,1.0,4938.0,3.0,3.0,What is the appearance of the oven?,10.0,2.0,,,,
Encode-Decode_Experiment-1-1,2347025,encoding,0.098753,0.473684,0.460684,0.131642,19,9,False,0.098077,0.100803,26,11,39,37,0.9487,0.101181,1.0,4866.0,1.0,1.0,Where is the baby in relation to the mother?,1.0,5607.0,2.0,2.0,Who is holding the umbrella in the scene?,11.0,2.0,,,,
Encode-Decode_Experiment-1-1,2349475,encoding,1.168152,0.291667,0.184917,0.091384,24,7,False,0.089086,0.054041,15,21,37,36,0.973,0.070533,1.0,4998.0,3.0,3.0,Which part of the blender is the woman holding?,0.0,14841.0,2.0,1.0,What is the man doing to power the blender?,12.0,1.0,,,,
Encode-Decode_Experiment-1-1,2394020,encoding,1.776663,0.615385,0.351692,0.14842,13,8,False,0.183927,0.232903,24,3,33,27,0.8182,0.211957,1.0,11365.0,1.0,1.0,Where is the scene taking place?,1.0,3777.0,2.0,2.0,What are the riders wearing on their heads?,13.0,2.0,,,,
Encode-Decode_Experiment-1-1,2362704,encoding,-0.792589,0.045455,0.099455,0.068131,22,1,False,0.209003,0.157402,2,24,28,26,0.9286,0.175742,1.0,4644.0,4.0,4.0,What are the bears doing with the pumpkins?,1.0,3040.0,2.0,2.0,How many bears are in the scene?,16.0,2.0,,,,
Encode-Decode_Experiment-1-1,2385550,encoding,2.217431,0.391304,0.199174,0.086646,23,9,False,0.279624,0.292266,19,13,34,32,0.9412,0.305476,1.0,6081.0,3.0,3.0,Which side of the frame is the boy on? (from your perspective),1.0,4534.0,4.0,4.0,Where are the tangerines in the scene?,17.0,2.0,,,,
Encode-Decode_Experiment-1-1,2410309,encoding,2.29324,0.36,0.16272,0.086027,25,9,False,0.292115,0.298995,17,17,36,34,0.9444,0.285861,1.0,3857.0,2.0,2.0,What is the baby touching?,1.0,3350.0,4.0,4.0,How many laptops or electronic devices are visible?,20.0,2.0,,,,
Encode-Decode_Experiment-1-1,2356125,encoding,1.7459,0.32,0.18104,0.079592,25,8,False,0.342058,0.22663,18,15,34,33,0.9706,0.284523,1.0,3847.0,2.0,2.0,How many uniformed staff are moving the luggage?,1.0,5075.0,1.0,1.0,Where is the luggage being moved to?,22.0,2.0,,,,
Encode-Decode_Experiment-1-1,2348899,encoding,4.591028,0.75,0.2456,0.109866,20,15,False,0.217957,0.119061,28,4,32,32,1.0,0.205595,1.0,5228.0,4.0,4.0,What is the woman doing?,1.0,9034.0,1.0,1.0,Where is the woman located relative to the man? (from your perspective),23.0,2.0,,,,
Encode-Decode_Experiment-1-1,2350974,encoding,4.20909,0.736842,0.259579,0.113389,19,14,False,0.272914,0.241189,26,5,38,31,0.8158,0.278012,1.0,5186.0,4.0,4.0,Between which two objects is the child standing?,1.0,8762.0,1.0,1.0,What is the child up against?,24.0,2.0,,,,
Encode-Decode_Experiment-1-1,2383555,encoding,-0.030115,0.2,0.2028,0.092978,25,5,False,0.211438,0.14111,10,23,34,33,0.9706,0.165578,0.0,7759.0,3.0,2.0,Who is holding the child in the boat?,1.0,4709.0,4.0,4.0,What is the woman at the back doing in the boat?,26.0,1.0,,,,
Encode-Decode_Experiment-1-1,2409918,encoding,2.408731,0.473684,0.224211,0.103571,19,9,False,0.169894,0.098334,25,10,35,35,1.0,0.149448,1.0,9968.0,4.0,4.0,Where are the elephants in the scene?,1.0,6438.0,2.0,2.0,What is the elephant on the right (from your perspective) doing with its trunk?,27.0,2.0,,,,
Encode-Decode_Experiment-1-1,2347400,encoding,0.212464,0.222222,0.199444,0.107208,18,4,False,0.198821,0.245429,9,18,30,27,0.9,0.241136,1.0,3779.0,3.0,3.0,What are the men doing with the wine?,1.0,2865.0,1.0,1.0,What are the men sitting on in the scene?,31.0,2.0,,,,
Encode-Decode_Experiment-1-1,2408717,encoding,1.46445,0.363636,0.219955,0.098113,22,8,False,0.193703,0.220917,21,11,37,32,0.8649,0.207272,1.0,2675.0,2.0,2.0,How many surfers are in the scene?,1.0,4633.0,3.0,3.0,What are the surfers doing with the surfboards?,32.0,2.0,,,,
Encode-Decode_Experiment-1-1,2386442,encoding,2.947547,0.769231,0.331385,0.148546,13,10,False,0.136657,0.144387,33,3,37,36,0.973,0.134292,1.0,6336.0,3.0,3.0,What is the person on the right wearing?,1.0,6401.0,1.0,1.0,Who is brushing their teeth in the scene?,33.0,2.0,,,,
Encode-Decode_Experiment-1-1,2385851,encoding,0.29707,0.12,0.1012,0.063285,25,3,False,0.16401,0.12087,6,22,31,28,0.9032,0.15682,1.0,6572.0,3.0,3.0,Where are the men?,1.0,3877.0,2.0,2.0,What are the men doing with the suitcases?,35.0,2.0,,,,
Encode-Decode_Experiment-1-1,2344622,encoding,0.018231,0.333333,0.330417,0.159986,12,4,False,0.169364,0.246224,9,10,24,19,0.7917,0.254556,1.0,3713.0,4.0,4.0,What is the cat resting its head on?,1.0,8759.0,2.0,2.0,Where is the cat located?,37.0,2.0,,,,
Encode-Decode_Experiment-1-1,2411268,encoding,2.743085,0.6,0.2838,0.115272,20,12,False,0.159698,0.437671,23,8,32,31,0.9688,0.234453,0.0,9988.0,1.0,4.0,Where is the fruit branch relative to the child?,1.0,7151.0,2.0,2.0,What is the child holding while picking fruit?,38.0,1.0,,,,
Encode-Decode_Experiment-1-1,2345035,encoding,-0.53349,0.25,0.305964,0.104902,28,7,False,0.234224,0.247613,15,21,41,36,0.878,0.23046,1.0,6065.0,3.0,3.0,What are the people doing with the football?,1.0,5287.0,2.0,2.0,Who runs toward the football in the scene?,42.0,2.0,,,,
Encode-Decode_Experiment-1-1,2370664,encoding,4.605735,0.555556,0.141389,0.089924,18,10,False,0.144682,0.152652,28,12,40,40,1.0,0.147073,1.0,3329.0,1.0,1.0,Where are the people located in the scene?,1.0,3201.0,4.0,4.0,How many donuts are in the scene?,45.0,2.0,,,,
Encode-Decode_Experiment-1-1,2367132,encoding,2.469503,0.380952,0.154952,0.091516,21,8,False,0.120313,0.081787,21,15,37,36,0.973,0.103802,1.0,4443.0,4.0,4.0,In which hand(s) are the men holding the controllers?,1.0,3240.0,2.0,2.0,How many men are playing in the scene?,46.0,2.0,,,,
Encode-Decode_Experiment-1-1,2362704,decoding,,0.0,0.0,0.0,7,0,False,,0.105714,0,15,19,15,0.7895,0.088457,,,,,,,,,,,,,two bears eating a pumpkin. two black bears.half eaten pumpkin,55163.0,1.0,Which description best matches the image?
Encode-Decode_Experiment-1-1,2367132,decoding,0.318221,0.75,0.6645,0.268682,4,3,False,0.060864,,10,0,10,10,1.0,0.060864,,,,,,,,,,,,,"two men playing v'deo games, a small child sitting on a sofa in the background. two blonde men with wii controllers",63967.0,2.0,Which description best matches the image?
Encode-Decode_Experiment-1-1,2412687,decoding,,0.0,0.0,0.0,4,0,False,,0.063599,0,12,14,12,0.8571,0.065487,,,,,,,,,,,,,a man playing with a dog' the dog is trying to grab the red frisbee' at night,35594.0,3.0,Which description best matches the image?
Encode-Decode_Experiment-1-1,2371471,decoding,1.110112,0.8,0.499,0.271144,5,4,False,0.102446,,16,0,16,16,1.0,0.102446,,,,,,,,,,,,,a child rinking something in between a car and a motorcycle. the car was red amd the motorcycle was blue.,67237.0,4.0,Which description best matches the image?
Encode-Decode_Experiment-1-1,2344622,decoding,,1.0,1.0,0.0,1,1,True,0.166048,,18,0,18,18,1.0,0.166048,,,,,,,,,,,,,"a cat next to a keyboard, lounging on a blue blanket.",32372.0,5.0,Which description best matches the image?
Encode-Decode_Experiment-1-1,2408717,decoding,-0.481428,0.25,0.3385,0.183828,8,2,False,0.059474,0.047311,4,20,26,24,0.9231,0.048856,,,,,,,,,,,,,"four women on a beach with surfboards, the ones closer to the photographer had neon green surfboards",51079.0,6.0,Which description best matches the image?
Encode-Decode_Experiment-1-1,2370664,decoding,-0.541137,0.5,0.6505,0.278118,4,2,False,0.154614,0.159884,7,9,17,16,0.9412,0.159114,,,,,,,,,,,,,"two men and one woman eating donut in the street, the woman was standing in the middle of the two men, she had a red shirt on.",54622.0,7.0,Which description best matches the image?
Encode-Decode_Experiment-1-1,2356991,decoding,,0.0,0.0,0.0,6,0,False,,0.115091,0,18,20,18,0.9,0.10691,,,,,,,,,,,,,"two baseball player in the middle of a game, the player on the left is diving head first to grab the ball, the player on the right is trying to catch the ball with a focused face",79990.0,8.0,Which description best matches the image?
Encode-Decode_Experiment-1-1,2409918,decoding,-0.921624,0.181818,0.328818,0.159501,11,2,False,0.072718,0.092482,4,13,20,17,0.85,0.088457,,,,,,,,,,,,,"two men sitting on top of two elephants, the elephants are in water the elephant on the right is eating plants.",58745.0,9.0,Which description best matches the image?
Encode-Decode_Experiment-1-1,2374670,decoding,0.828019,0.5,0.336,0.198063,8,4,False,0.217528,0.201566,20,2,22,22,1.0,0.216077,,,,,,,,,,,,,"a red spray vehicle, a man on the back of a spray vehicle",38925.0,10.0,Which description best matches the image?
Encode-Decode_Experiment-1-1,2394020,decoding,1.555962,0.777778,0.499333,0.178953,9,7,False,0.316395,0.227608,21,1,23,22,0.9565,0.29959,,,,,,,,,,,,,"two men wearing cowboy hats are on horses, the horses are walking alongside a shore",37777.0,11.0,Which description best matches the image?
Encode-Decode_Experiment-1-1,2387122,decoding,0.315373,0.545455,0.494455,0.161713,11,6,False,0.160792,0.179697,14,3,20,17,0.85,0.150246,,,,,,,,,,,,,a big polar bear in a zoo enclosure pawing at the glass that is seperating the photograper from the bear.the photographer had gray hair,61612.0,12.0,Which description best matches the image?
Encode-Decode_Experiment-1-1,2369373,decoding,0.250421,0.714286,0.666,0.192818,7,5,False,0.081628,0.329965,12,1,13,13,1.0,0.100731,,,,,,,,,,,,,,47037.0,13.0,Which description best matches the image?
Encode-Decode_Experiment-1-1,2385550,decoding,1.27053,0.888889,0.669444,0.172719,9,8,False,0.236058,,18,0,18,18,1.0,0.236058,,,,,,,,,,,,,one boy and one girl is eating tangerines next to each other. the boy is on the left of the screne and the girl is on the right of the screen. both children has brown eyes,64294.0,14.0,Which description best matches the image?
Encode-Decode_Experiment-1-1,2356125,decoding,,0.0,0.0,0.0,5,0,False,,0.071504,0,18,18,18,1.0,0.071504,,,,,,,,,,,,,"four airport personnel (three woemn, one man) is standign next to a converyor belt, the two woman are putting the baggade on to converyor belt manually.",61707.0,15.0,Which description best matches the image?
Encode-Decode_Experiment-1-1,2350974,decoding,-0.436861,0.125,0.193375,0.156514,8,1,False,0.374164,0.190093,2,15,17,17,1.0,0.211749,,,,,,,,,,,,,a child in between a red and blue car drinking something.,29496.0,16.0,Which description best matches the image?
Encode-Decode_Experiment-1-1,2385851,decoding,0.106475,0.222222,0.205778,0.154444,9,2,False,0.180228,0.145542,7,8,16,15,0.9375,0.152109,,,,,,,,,,,,,"two men carrying suitcases, both suitcases are red.",31718.0,17.0,Which description best matches the image?
Encode-Decode_Experiment-1-1,2347400,decoding,-1.108892,0.0,0.204167,0.184118,6,0,False,,0.069835,0,21,21,21,1.0,0.069835,,,,,,,,,,,,,two men smelling red wine sitting on a couch. there is a pokemon ball in the background,31252.0,18.0,Which description best matches the image?
Encode-Decode_Experiment-1-1,2347025,decoding,2.153473,0.923077,0.602077,0.149062,13,12,False,0.08038,,18,0,19,18,0.9474,0.081798,,,,,,,,,,,,,one woamn and a child posing for a picture. the child is on the womans back holding a umbrella.,44220.0,19.0,Which description best matches the image?
Encode-Decode_Experiment-1-1,2410309,decoding,0.869228,0.533333,0.405733,0.146797,15,8,False,0.168944,0.189194,14,9,23,23,1.0,0.176868,,,,,,,,,,,,,a woman and a child sitting together on a couch. both of them have a laptop on their laps.,36405.0,20.0,Which description best matches the image?
Encode-Decode_Experiment-1-1,150472,decoding,0.198436,0.333333,0.298778,0.174139,9,3,False,0.169721,0.152771,6,6,12,12,1.0,0.161246,,,,,,,,,,,,,two women eating pizza from a paper plate in the middle of the street. the woman on the right wears glasses,38149.0,21.0,Which description best matches the image?
Encode-Decode_Experiment-1-1,2386442,decoding,-0.292939,0.357143,0.402286,0.154103,14,5,False,0.108614,0.095325,10,8,18,18,1.0,0.102708,,,,,,,,,,,,,a woman a child and a man are brushing their teeth. the man on the r'ght is wearing a purple shirt.,66095.0,22.0,Which description best matches the image?
Encode-Decode_Experiment-1-1,2397102,decoding,-0.70186,0.0,0.094833,0.135117,6,0,False,,0.059363,0,19,21,19,0.9048,0.054078,,,,,,,,,,,,,"one man and one woman is cutting a cake, the man on the right is holding a beer bottle in his other hand whilst cutting hte cake.",67717.0,23.0,Which description best matches the image?
Encode-Decode_Experiment-1-1,2345035,decoding,-0.963741,0.333333,0.527,0.200953,9,3,False,0.149258,0.26283,6,9,17,15,0.8824,0.196564,,,,,,,,,,,,,two girls chasing a football. one has a jersey that has the number 20 on it.,28746.0,24.0,Which description best matches the image?
Encode-Decode_Experiment-1-1,2411268,decoding,1.847853,0.785714,0.493714,0.158021,14,11,False,0.084992,0.092541,19,1,20,20,1.0,0.08537,,,,,,,,,,,,,a girl with pink boots picking apples form the tree above her head.,23197.0,25.0,Which description best matches the image?
Encode-Decode_Experiment-1-1,2348899,decoding,0.12414,0.333333,0.3075,0.208098,6,2,False,0.118477,0.128816,7,9,17,16,0.9412,0.12461,,,,,,,,,,,,,"a man at the center of the photograph, there is two toher men on the left side of the man with the pink tie. a woman is on thr roght of the man at the center. the woman is touching the pink tie on the mans neck.",71566.0,26.0,Which description best matches the image?
Encode-Decode_Experiment-1-1,2360001,decoding,1.295706,0.25,0.100875,0.115092,8,2,False,0.084079,0.11166,7,11,19,18,0.9474,0.095826,,,,,,,,,,,,,four people fixing a clock standing on a scaffold.,24145.0,27.0,Which description best matches the image?
Encode-Decode_Experiment-1-1,2349475,decoding,2.117316,0.4,0.1397,0.122939,10,4,False,0.043002,0.070038,10,9,19,19,1.0,0.055809,,,,,,,,,,,,,"there is a blender at the center of the oicture, the man on the left pf the blender is riding a bike, there is a woman on the left of the belnder holding the lid of the belnder, and there is a person in the background.",77043.0,28.0,Which description best matches the image?
Encode-Decode_Experiment-1-1,2379478,decoding,,0.0,0.0,0.0,8,0,False,,0.499424,0,22,24,22,0.9167,0.458496,,,,,,,,,,,,,two baby gitls lying in a bed drinking milk form bottles.,22883.0,29.0,Which description best matches the image?
Encode-Decode_Experiment-1-1,2383555,decoding,1.132425,0.375,0.195625,0.158399,8,3,False,0.175121,0.227028,9,7,17,16,0.9412,0.189631,,,,,,,,,,,,,two women and one child on a wooden boat. the woman at the front of the boat is holding a childe and the woman at the back of the boat is rowing the boat.,57145.0,30.0,Which description best matches the image?
Encode-Decode_Experiment-10-1,2362704,encoding,1.880256,0.333333,0.182967,0.079971,30,10,False,0.248115,0.1542,17,17,35,34,0.9714,0.199018,1.0,4528.0,4.0,4.0,What are the bears doing with the pumpkins?,1.0,2438.0,2.0,2.0,How many bears are in the scene?,1.0,2.0,,,,
Encode-Decode_Experiment-10-1,150472,encoding,-0.859561,0.15,0.24775,0.113721,20,3,False,0.087219,0.075484,5,23,31,28,0.9032,0.092926,1.0,3338.0,2.0,2.0,Where is the pizza slice located?,1.0,2893.0,4.0,4.0,How many women are in the scene?,2.0,2.0,,,,
Encode-Decode_Experiment-10-1,2370664,encoding,-0.010006,0.214286,0.2155,0.121359,14,3,False,0.069476,0.126217,6,16,26,22,0.8462,0.122232,1.0,3833.0,1.0,1.0,Where are the people located in the scene?,0.0,2566.0,3.0,4.0,How many donuts are in the scene?,4.0,1.0,,,,
Encode-Decode_Experiment-10-1,2379478,encoding,0.921081,0.35,0.2475,0.111282,20,7,False,0.319026,0.389875,18,12,31,30,0.9677,0.355879,1.0,2007.0,2.0,2.0,How many babies are visible in the scene?,1.0,5045.0,4.0,4.0,What is the position of the babies?,5.0,2.0,,,,
Encode-Decode_Experiment-10-1,2412687,encoding,0.594297,0.416667,0.326083,0.152421,12,5,False,0.123179,0.199847,12,4,28,16,0.5714,0.119551,1.0,3895.0,3.0,3.0,What is the human's body position?,1.0,3399.0,4.0,4.0,What is the dog biting onto in the scene?,6.0,2.0,,,,
Encode-Decode_Experiment-10-1,2347025,encoding,0.508345,0.52381,0.460143,0.125243,21,11,False,0.125089,0.154398,28,6,34,34,1.0,0.130261,1.0,3994.0,1.0,1.0,Where is the baby in relation to the mother?,0.0,4496.0,3.0,2.0,Who is holding the umbrella in the scene?,7.0,1.0,,,,
Encode-Decode_Experiment-10-1,2356125,encoding,2.47984,0.5,0.243727,0.103342,22,11,False,0.235264,0.258587,25,10,37,35,0.9459,0.249079,1.0,2514.0,1.0,1.0,Where is the luggage being moved to?,1.0,3297.0,2.0,2.0,How many uniformed staff are moving the luggage?,8.0,2.0,,,,
Encode-Decode_Experiment-10-1,2350974,encoding,2.945957,0.8,0.3145,0.164802,10,8,False,0.256598,,19,0,25,19,0.76,0.238674,1.0,2261.0,1.0,1.0,What is the child up against?,1.0,4270.0,4.0,4.0,Between which two objects is the child standing?,9.0,2.0,,,,
Encode-Decode_Experiment-10-1,2383555,encoding,0.816161,0.285714,0.199952,0.10508,21,6,False,0.302928,0.158923,10,16,32,26,0.8125,0.204814,1.0,3491.0,2.0,2.0,Who is holding the child in the boat?,1.0,4016.0,4.0,4.0,What is the woman at the back doing in the boat?,10.0,2.0,,,,
Encode-Decode_Experiment-10-1,2369373,encoding,2.615965,0.777778,0.427389,0.133942,18,14,False,0.261421,0.402052,24,1,26,25,0.9615,0.261874,1.0,4815.0,3.0,3.0,What is the appearance of the oven?,1.0,4239.0,3.0,3.0,What tool is the chef using?,11.0,2.0,,,,
Encode-Decode_Experiment-10-1,2385550,encoding,0.843475,0.388889,0.287722,0.11994,18,7,False,0.276524,0.262302,14,14,32,28,0.875,0.277336,1.0,4548.0,3.0,3.0,Which side of the frame is the boy on? (from your perspective),1.0,3141.0,4.0,4.0,Where are the tangerines in the scene?,13.0,2.0,,,,
Encode-Decode_Experiment-10-1,2348899,encoding,4.18893,0.608696,0.217739,0.093331,23,14,False,0.201666,0.175792,22,6,28,28,1.0,0.196122,1.0,6102.0,1.0,1.0,Where is the woman located relative to the man? (from your perspective),1.0,3203.0,4.0,4.0,What is the woman doing?,14.0,2.0,,,,
Encode-Decode_Experiment-10-1,2411268,encoding,0.473765,0.461538,0.388769,0.153598,13,6,False,0.243625,0.288897,16,9,26,25,0.9615,0.264995,1.0,6114.0,4.0,4.0,Where is the fruit branch relative to the child?,0.0,23799.0,1.0,2.0,What is the child holding while picking fruit?,15.0,1.0,,,,
Encode-Decode_Experiment-10-1,2387122,encoding,-0.136416,0.421053,0.439421,0.13465,19,8,False,0.179375,0.28172,13,11,24,24,1.0,0.226283,1.0,4071.0,3.0,3.0,Where is the polar bear located in the scene?,1.0,3613.0,1.0,1.0,What is the polar bear doing next to the enclosure edge?,17.0,2.0,,,,
Encode-Decode_Experiment-10-1,2349475,encoding,0.821209,0.153846,0.084154,0.084866,13,2,False,0.065656,0.09436,3,20,25,23,0.92,0.088054,1.0,2724.0,3.0,3.0,Which part of the blender is the woman holding?,1.0,3992.0,1.0,1.0,What is the man doing to power the blender?,18.0,2.0,,,,
Encode-Decode_Experiment-10-1,2410309,encoding,0.661148,0.263158,0.192158,0.107389,19,5,False,0.287865,0.226602,11,15,26,26,1.0,0.252521,1.0,5188.0,2.0,2.0,What is the baby touching?,1.0,3019.0,4.0,4.0,How many laptops or electronic devices are visible?,20.0,2.0,,,,
Encode-Decode_Experiment-10-1,2344622,encoding,-0.988013,0.25,0.386562,0.138219,16,4,False,0.153564,0.260008,8,17,31,25,0.8065,0.256139,1.0,3365.0,4.0,4.0,What is the cat resting its head on?,1.0,4642.0,2.0,2.0,Where is the cat located?,22.0,2.0,,,,
Encode-Decode_Experiment-10-1,2397102,encoding,1.887584,0.5,0.27925,0.116948,20,10,False,0.116305,0.084022,27,5,34,32,0.9412,0.105677,1.0,2309.0,1.0,1.0,What are the couple doing with the cake?,1.0,3756.0,3.0,3.0,What is the man holding besides the cake knife?,23.0,2.0,,,,
Encode-Decode_Experiment-10-1,2409918,encoding,-0.195526,0.352941,0.379176,0.134178,17,6,False,0.170519,0.124303,16,10,35,26,0.7429,0.131688,1.0,5345.0,4.0,4.0,Where are the elephants in the scene?,1.0,3997.0,2.0,2.0,What is the elephant on the right (from your perspective) doing with its trunk?,24.0,2.0,,,,
Encode-Decode_Experiment-10-1,2374670,encoding,0.029488,0.714286,0.709929,0.14776,14,10,False,0.17199,0.258162,17,7,28,24,0.8571,0.215653,1.0,4770.0,1.0,1.0,What vehicle sprays water in the scene?,1.0,5684.0,3.0,3.0,Where is the man standing relative to the vehicle?,25.0,2.0,,,,
Encode-Decode_Experiment-10-1,2360001,encoding,2.026076,0.285714,0.104571,0.089406,14,4,False,0.261531,0.219258,9,14,23,23,1.0,0.235799,1.0,4442.0,4.0,4.0,Where are the men standing?,1.0,3459.0,4.0,4.0,What are the workers doing to the clock?,27.0,2.0,,,,
Encode-Decode_Experiment-10-1,2347400,encoding,0.444285,0.4,0.3264,0.165659,10,4,False,0.138936,0.267598,21,11,37,32,0.8649,0.188872,1.0,2603.0,1.0,1.0,What are the men sitting on in the scene?,1.0,4788.0,3.0,3.0,What are the men doing with the wine?,29.0,2.0,,,,
Encode-Decode_Experiment-10-1,2408717,encoding,-0.059029,0.222222,0.228778,0.111057,18,4,False,0.157241,0.270898,12,12,28,24,0.8571,0.215179,1.0,3635.0,2.0,2.0,How many surfers are in the scene?,1.0,2977.0,3.0,3.0,What are the surfers doing with the surfboards?,30.0,2.0,,,,
Encode-Decode_Experiment-10-1,2394020,encoding,1.732468,0.8,0.4745,0.187882,10,8,False,0.252803,,15,0,19,15,0.7895,0.247894,1.0,3488.0,1.0,1.0,Where is the scene taking place?,1.0,3246.0,2.0,2.0,What are the riders wearing on their heads?,33.0,2.0,,,,
Encode-Decode_Experiment-10-1,2356991,encoding,2.220155,0.5,0.238,0.11801,16,8,False,0.128548,0.042288,20,10,31,30,0.9677,0.102377,1.0,5505.0,2.0,2.0,What is the current action of the gloved player on the base?,1.0,6324.0,1.0,1.0,How is the player on the left (from your perspective) reaching the base?,36.0,2.0,,,,
Encode-Decode_Experiment-10-1,2386442,encoding,-0.711952,0.545455,0.667818,0.171871,11,6,False,0.129535,0.134756,13,7,20,20,1.0,0.131362,1.0,4429.0,3.0,3.0,What is the person on the right wearing?,1.0,4695.0,1.0,1.0,Who is brushing their teeth in the scene?,37.0,2.0,,,,
Encode-Decode_Experiment-10-1,2345035,encoding,-0.090433,0.277778,0.289611,0.130852,18,5,False,0.17469,0.20841,12,14,40,26,0.65,0.167931,0.0,3175.0,2.0,3.0,What are the people doing with the football?,1.0,6623.0,2.0,2.0,Who runs toward the football in the scene?,41.0,1.0,,,,
Encode-Decode_Experiment-10-1,2371471,encoding,1.413843,0.4,0.1956,0.144571,10,4,False,0.148076,0.373248,31,14,45,45,1.0,0.218129,1.0,7062.0,2.0,2.0,What stunt is one motorcyclist performing?,1.0,4367.0,3.0,3.0,What is nearest to the motorcyclists?,42.0,2.0,,,,
Encode-Decode_Experiment-10-1,2385851,encoding,-0.674388,0.133333,0.215067,0.121196,15,2,False,0.367904,0.224178,6,13,30,19,0.6333,0.33537,1.0,5412.0,3.0,3.0,Where are the men?,1.0,2633.0,2.0,2.0,What are the men doing with the suitcases?,46.0,2.0,,,,
Encode-Decode_Experiment-10-1,2367132,encoding,2.837132,0.5,0.165167,0.118018,12,6,False,0.105676,0.034278,11,11,22,22,1.0,0.069977,1.0,2315.0,2.0,2.0,How many men are playing in the scene?,0.0,7330.0,1.0,4.0,In which hand(s) are the men holding the controllers?,55.0,1.0,,,,
Encode-Decode_Experiment-10-1,2344622,decoding,,0.0,0.0,0.0,3,0,False,,0.169863,0,11,11,11,1.0,0.169863,,,,,,,,,,,,,"cat laying on a blue blanket next to a keyboard while a hand is typing, brownish cat",25060.0,1.0,Which description best matches the image?
