SubjectID,StimID,Phase,svg_z,svg_obs,svg_null_mean,svg_null_std,n_transitions,n_relational,low_n,mean_salience_relational,mean_salience_nonrelational,n_relational_fixations,n_nonrelational_fixations,n_fixations,n_aoi,aoi_prop,mean_salience,enc_q1_accuracy,enc_q1_rt_ms,enc_q1_response,enc_q1_correct_key,enc_q1_question,enc_q2_accuracy,enc_q2_rt_ms,enc_q2_response,enc_q2_correct_key,enc_q2_question,enc_trial_index,enc_total_correct,dec_free_response,dec_rt_ms,dec_trial_index,dec_cue_question
Encode-Decode_Experiment-3-1,2387122,decoding,,0.0,0.0,0.0,1,0,True,,0.046789,0,3,14,3,0.2143,0.07146,,,,,,,,,,,,,in an enclosure of water with blonde woman holding camera to glass,12734.0,4.0,Which description best matches the image?
Encode-Decode_Experiment-3-1,2410309,decoding,,0.0,0.0,0.0,2,0,False,,0.15008,0,6,6,6,1.0,0.15008,,,,,,,,,,,,,mum in red top facing forward on couch and baby on side with another laptop,16315.0,5.0,Which description best matches the image?
Encode-Decode_Experiment-3-1,2356991,decoding,,,,,0,0,True,,0.043374,0,11,11,11,1.0,0.043374,,,,,,,,,,,,,man diving and another about to catch,8224.0,6.0,Which description best matches the image?
Encode-Decode_Experiment-3-1,2386442,decoding,,1.0,1.0,0.0,2,2,False,0.157036,,6,0,8,6,0.75,0.12274,,,,,,,,,,,,,mum baby dad brushing teeth together,6809.0,7.0,Which description best matches the image?
Encode-Decode_Experiment-3-1,2348899,decoding,0.492761,0.666667,0.499,0.34026,3,2,False,0.087892,0.094763,5,1,6,6,1.0,0.089038,,,,,,,,,,,,,two men in background one sat with tie and woman touching tie,11233.0,8.0,Which description best matches the image?
Encode-Decode_Experiment-3-1,2362704,decoding,,0.0,0.0,0.0,3,0,False,,0.03196,0,4,7,4,0.5714,0.01996,,,,,,,,,,,,,two black bears on ground eating pumpkins,8633.0,9.0,Which description best matches the image?
Encode-Decode_Experiment-3-1,2370664,decoding,-0.477396,0.5,0.675,0.366572,2,1,False,0.256711,0.211774,2,1,7,3,0.4286,0.282149,,,,,,,,,,,,,two men and a woman each eating donut on the street,9618.0,10.0,Which description best matches the image?
Encode-Decode_Experiment-3-1,2367132,decoding,-1.583988,0.333333,0.670333,0.212754,6,2,False,0.059458,0.032882,6,6,12,12,1.0,0.04617,,,,,,,,,,,,,"two men play wii ga,me and daughter watches on couch",10604.0,11.0,Which description best matches the image?
Encode-Decode_Experiment-3-1,2394020,decoding,,1.0,1.0,0.0,1,1,True,0.115845,,12,0,12,12,1.0,0.115845,,,,,,,,,,,,,two men with cowboy hats ride horses down beach at sunset,11518.0,12.0,Which description best matches the image?
Encode-Decode_Experiment-3-1,2412687,decoding,0.579391,0.25,0.164375,0.147784,8,2,False,0.005509,0.039652,7,12,20,19,0.95,0.025826,,,,,,,,,,,,,dont recall,2802.0,13.0,Which description best matches the image?
Encode-Decode_Experiment-3-1,2408717,decoding,0.256873,0.4,0.337,0.245257,5,2,False,0.195729,0.116761,13,2,15,15,1.0,0.1852,,,,,,,,,,,,,four women walk towards ocean holding green surfboards,12244.0,14.0,Which description best matches the image?
Encode-Decode_Experiment-3-1,2356125,decoding,,,,,0,0,True,,0.040274,0,9,9,9,1.0,0.040274,,,,,,,,,,,,,3 women and a man stand next tpo conveyer and two women putting a suitcase onto another,19740.0,15.0,Which description best matches the image?
Encode-Decode_Experiment-3-1,2379478,decoding,1.302111,1.0,0.662,0.259578,4,4,False,0.249157,,5,0,5,5,1.0,0.249157,,,,,,,,,,,,,toddler and smaller baby drink bottle of milk each lying on their backs in bed,15376.0,16.0,Which description best matches the image?
Encode-Decode_Experiment-3-1,2360001,decoding,-1.579801,0.0,0.34,0.215217,7,0,False,,0.217801,0,12,12,12,1.0,0.217801,,,,,,,,,,,,,3 men stand on scaffolding putting clock up on a street,10930.0,17.0,Which description best matches the image?
Encode-Decode_Experiment-3-1,2371471,decoding,0.306224,0.75,0.66625,0.273493,4,3,False,0.213309,0.041774,13,1,15,14,0.9333,0.188777,,,,,,,,,,,,,small child drinking stoof between red car and motorcycle,10766.0,18.0,Which description best matches the image?
Encode-Decode_Experiment-3-1,2350974,decoding,1.899733,0.75,0.39875,0.184894,8,6,False,0.201868,,16,0,18,16,0.8889,0.184981,,,,,,,,,,,,,small child having a drink in between two vehicles,9610.0,19.0,Which description best matches the image?
Encode-Decode_Experiment-3-1,2347025,decoding,,1.0,1.0,0.0,1,1,True,0.0524,,6,0,6,6,1.0,0.0524,,,,,,,,,,,,,baby on mothers back holding pink umbrellla,7611.0,20.0,Which description best matches the image?
Encode-Decode_Experiment-3-1,2374670,decoding,,,,,0,0,True,,0.078419,0,17,17,17,1.0,0.078419,,,,,,,,,,,,,red farem vehicle rriving down dirt track spraying water with man on the back and campervans behind,21500.0,21.0,Which description best matches the image?
Encode-Decode_Experiment-3-1,2344622,decoding,-0.495055,0.333333,0.499667,0.335989,3,1,False,0.112047,0.093432,4,3,7,7,1.0,0.104069,,,,,,,,,,,,,persons hand on keyboard and cat to the left lying on blue blanket,12296.0,22.0,Which description best matches the image?
Encode-Decode_Experiment-3-1,2385851,decoding,,0.0,0.0,0.0,5,0,False,,0.229994,0,10,10,10,1.0,0.229994,,,,,,,,,,,,,two men carry suitcases opn their backs along a covered walkway wearing loose clothing,16630.0,23.0,Which description best matches the image?
Encode-Decode_Experiment-3-1,2385550,decoding,1.861125,1.0,0.513,0.26167,5,5,False,0.095316,,10,0,10,10,1.0,0.095316,,,,,,,,,,,,,older sister and younger brother both pose for picture with orange pieces in their mouths,15127.0,24.0,Which description best matches the image?
Encode-Decode_Experiment-3-1,2397102,decoding,,,,,0,0,True,,0.045433,0,12,12,12,1.0,0.045433,,,,,,,,,,,,,woman in dress and man next to her holding beer cut a colourful cake,11868.0,25.0,Which description best matches the image?
Encode-Decode_Experiment-3-1,2347400,decoding,,,,,0,0,True,,0.014773,0,2,2,2,1.0,0.014773,,,,,,,,,,,,,two boys smell red wine sat in casual clothes on cpuch in living room,12323.0,26.0,Which description best matches the image?
Encode-Decode_Experiment-3-1,2411268,decoding,,0.0,0.0,0.0,1,0,True,,0.07675,0,13,13,13,1.0,0.07675,,,,,,,,,,,,,little girl in pink wellies and holding red bag reaches up to pick green apple,26974.0,27.0,Which description best matches the image?
Encode-Decode_Experiment-3-1,150472,decoding,1.083631,0.6,0.3386,0.241226,5,3,False,0.052493,0.052181,5,2,7,7,1.0,0.052404,,,,,,,,,,,,,man in chef clothes slides p;izza into stone oven looks like a greek statue,14793.0,28.0,Which description best matches the image?
Encode-Decode_Experiment-3-1,2369373,decoding,1.864385,0.5,0.1935,0.164397,8,4,False,0.205113,0.079998,8,2,11,10,0.9091,0.169613,,,,,,,,,,,,,man slides pizza into oven,6788.0,29.0,Which description best matches the image?
Encode-Decode_Experiment-3-1,2345035,decoding,0.002203,0.333333,0.332667,0.302581,3,1,False,0.188995,0.493192,3,2,7,5,0.7143,0.250669,,,,,,,,,,,,,20 chases 3 with football across a field with parents in background,12565.0,30.0,Which description best matches the image?
Encode-Decode_Experiment-4-1,2397102,encoding,3.868398,0.518519,0.176037,0.088533,27,14,False,0.133277,0.074616,26,10,36,36,1.0,0.116982,1.0,9432.0,3.0,3.0,What is the man holding besides the cake knife?,1.0,2935.0,1.0,1.0,What are the couple doing with the cake?,1.0,2.0,,,,
Encode-Decode_Experiment-4-1,2356125,encoding,-0.932934,0.153846,0.289154,0.145035,13,2,False,0.189955,0.118763,7,23,33,30,0.9091,0.135133,1.0,5575.0,2.0,2.0,How many uniformed staff are moving the luggage?,0.0,7698.0,4.0,1.0,Where is the luggage being moved to?,2.0,1.0,,,,
Encode-Decode_Experiment-4-1,2347400,encoding,0.428775,0.26087,0.218957,0.097751,23,6,False,0.183058,0.230503,18,15,37,33,0.8919,0.210394,1.0,6584.0,3.0,3.0,What are the men doing with the wine?,1.0,3796.0,1.0,1.0,What are the men sitting on in the scene?,3.0,2.0,,,,
Encode-Decode_Experiment-4-1,2379478,encoding,2.286533,0.48,0.25352,0.09905,25,12,False,0.317686,0.317793,20,16,36,36,1.0,0.317734,1.0,6000.0,4.0,4.0,What is the position of the babies?,1.0,3672.0,2.0,2.0,How many babies are visible in the scene?,4.0,2.0,,,,
Encode-Decode_Experiment-4-1,2385550,encoding,0.942902,0.259259,0.181333,0.082645,27,7,False,0.202926,0.253275,16,20,37,36,0.973,0.241754,0.0,4753.0,2.0,3.0,Which side of the frame is the boy on? (from your perspective),1.0,3409.0,4.0,4.0,Where are the tangerines in the scene?,5.0,1.0,,,,
Encode-Decode_Experiment-4-1,2362704,encoding,-0.063127,0.133333,0.137933,0.072869,30,4,False,0.190917,0.116873,7,25,32,32,1.0,0.13307,1.0,2269.0,2.0,2.0,How many bears are in the scene?,1.0,2925.0,4.0,4.0,What are the bears doing with the pumpkins?,7.0,2.0,,,,
Encode-Decode_Experiment-4-1,2394020,encoding,2.272976,0.833333,0.526722,0.134894,18,15,False,0.23297,0.225976,27,2,31,29,0.9355,0.241063,1.0,3299.0,2.0,2.0,What are the riders wearing on their heads?,1.0,5201.0,1.0,1.0,Where is the scene taking place?,8.0,2.0,,,,
Encode-Decode_Experiment-4-1,2374670,encoding,1.163703,0.48,0.35268,0.109409,25,12,False,0.245207,0.315939,22,8,33,30,0.9091,0.273023,1.0,10670.0,3.0,3.0,Where is the man standing relative to the vehicle?,1.0,5883.0,1.0,1.0,What vehicle sprays water in the scene?,9.0,2.0,,,,
Encode-Decode_Experiment-4-1,2409918,encoding,2.266893,0.666667,0.384556,0.124448,18,12,False,0.141503,0.145624,31,1,34,32,0.9412,0.143787,1.0,5324.0,2.0,2.0,What is the elephant on the right (from your perspective) doing with its trunk?,1.0,4161.0,4.0,4.0,Where are the elephants in the scene?,11.0,2.0,,,,
Encode-Decode_Experiment-4-1,2345035,encoding,0.221811,0.222222,0.201926,0.091502,27,6,False,0.122614,0.185886,9,23,39,32,0.8205,0.161992,1.0,7310.0,3.0,3.0,What are the people doing with the football?,1.0,4581.0,2.0,2.0,Who runs toward the football in the scene?,12.0,2.0,,,,
Encode-Decode_Experiment-4-1,2383555,encoding,-1.261587,0.0,0.091,0.072131,23,0,False,,0.181964,0,27,34,27,0.7941,0.162869,1.0,4161.0,2.0,2.0,Who is holding the child in the boat?,1.0,3201.0,4.0,4.0,What is the woman at the back doing in the boat?,13.0,2.0,,,,
Encode-Decode_Experiment-4-1,2386442,encoding,3.480106,0.666667,0.30863,0.102881,27,18,False,0.121099,0.108309,30,8,38,38,1.0,0.118407,0.0,4579.0,1.0,3.0,What is the person on the right wearing?,1.0,4371.0,1.0,1.0,Who is brushing their teeth in the scene?,14.0,1.0,,,,
Encode-Decode_Experiment-4-1,2385851,encoding,-0.167408,0.111111,0.12237,0.067256,27,3,False,0.098464,0.215537,7,24,33,31,0.9394,0.218636,1.0,9568.0,3.0,3.0,Where are the men?,1.0,3301.0,2.0,2.0,What are the men doing with the suitcases?,16.0,2.0,,,,
Encode-Decode_Experiment-4-1,2369373,encoding,1.294669,0.521739,0.368435,0.118412,23,12,False,0.197432,0.221974,27,9,38,36,0.9474,0.196659,1.0,4369.0,3.0,3.0,What tool is the chef using?,1.0,5755.0,3.0,3.0,What is the appearance of the oven?,17.0,2.0,,,,
Encode-Decode_Experiment-4-1,2410309,encoding,-0.958025,0.107143,0.196036,0.092788,28,3,False,0.235109,0.198696,7,29,37,36,0.973,0.207211,1.0,4688.0,2.0,2.0,What is the baby touching?,1.0,4008.0,4.0,4.0,How many laptops or electronic devices are visible?,19.0,2.0,,,,
Encode-Decode_Experiment-4-1,2412687,encoding,2.222007,0.428571,0.219143,0.094252,21,9,False,0.173355,0.263758,17,18,39,35,0.8974,0.206351,1.0,6241.0,4.0,4.0,What is the dog biting onto in the scene?,0.0,5765.0,2.0,3.0,What is the human's body position?,21.0,1.0,,,,
Encode-Decode_Experiment-4-1,2349475,encoding,1.760613,0.230769,0.110308,0.06842,26,6,False,0.096272,0.04711,16,20,38,36,0.9474,0.073026,1.0,3326.0,3.0,3.0,Which part of the blender is the woman holding?,1.0,12925.0,1.0,1.0,What is the man doing to power the blender?,22.0,2.0,,,,
Encode-Decode_Experiment-4-1,2347025,encoding,2.310167,0.636364,0.372,0.114435,22,14,False,0.102213,0.281211,26,3,34,29,0.8529,0.122783,1.0,4993.0,2.0,2.0,Who is holding the umbrella in the scene?,1.0,6543.0,1.0,1.0,Where is the baby in relation to the mother?,23.0,2.0,,,,
Encode-Decode_Experiment-4-1,2360001,encoding,2.558547,0.28,0.11396,0.064896,25,7,False,0.252321,0.408376,13,18,32,31,0.9688,0.333617,1.0,4401.0,4.0,4.0,Where are the men standing?,1.0,5281.0,4.0,4.0,What are the workers doing to the clock?,25.0,2.0,,,,
Encode-Decode_Experiment-4-1,2370664,encoding,-1.096386,0.1,0.19815,0.089521,20,2,False,0.173354,0.144422,5,30,35,35,1.0,0.148556,1.0,4449.0,1.0,1.0,Where are the people located in the scene?,1.0,2957.0,4.0,4.0,How many donuts are in the scene?,26.0,2.0,,,,
Encode-Decode_Experiment-4-1,2411268,encoding,1.906393,0.470588,0.246824,0.117376,17,8,False,0.167575,0.51752,17,8,32,25,0.7812,0.269349,1.0,5263.0,4.0,4.0,Where is the fruit branch relative to the child?,1.0,5133.0,2.0,2.0,What is the child holding while picking fruit?,27.0,2.0,,,,
Encode-Decode_Experiment-4-1,2387122,encoding,0.991322,0.35,0.23945,0.111518,20,7,False,0.170251,0.254234,14,8,25,22,0.88,0.19925,1.0,6511.0,1.0,1.0,What is the polar bear doing next to the enclosure edge?,1.0,3898.0,3.0,3.0,Where is the polar bear located in the scene?,30.0,2.0,,,,
Encode-Decode_Experiment-4-1,2344622,encoding,-0.064716,0.3,0.30715,0.110482,20,6,False,0.166072,0.263708,14,12,35,26,0.7429,0.246308,1.0,5850.0,2.0,2.0,Where is the cat located?,1.0,4554.0,4.0,4.0,What is the cat resting its head on?,31.0,2.0,,,,
Encode-Decode_Experiment-4-1,2408717,encoding,1.081479,0.217391,0.133391,0.077671,23,5,False,0.200659,0.253072,14,20,37,34,0.9189,0.232961,1.0,2687.0,2.0,2.0,How many surfers are in the scene?,0.0,3872.0,2.0,3.0,What are the surfers doing with the surfboards?,32.0,1.0,,,,
Encode-Decode_Experiment-4-1,2367132,encoding,5.522816,0.56,0.14384,0.075353,25,14,False,0.092799,0.063584,25,7,33,32,0.9697,0.086315,1.0,6597.0,4.0,4.0,In which hand(s) are the men holding the controllers?,1.0,3408.0,2.0,2.0,How many men are playing in the scene?,34.0,2.0,,,,
Encode-Decode_Experiment-4-1,2348899,encoding,3.054412,0.571429,0.249762,0.105312,21,12,False,0.199881,0.141777,30,6,36,36,1.0,0.190197,0.0,6606.0,4.0,1.0,Where is the woman located relative to the man? (from your perspective),1.0,4062.0,4.0,4.0,What is the woman doing?,38.0,1.0,,,,
Encode-Decode_Experiment-4-1,2356991,encoding,0.880077,0.259259,0.180593,0.089386,27,7,False,0.154902,0.112126,13,18,33,31,0.9394,0.136008,1.0,7111.0,2.0,2.0,What is the current action of the gloved player on the base?,1.0,8700.0,1.0,1.0,How is the player on the left (from your perspective) reaching the base?,40.0,2.0,,,,
Encode-Decode_Experiment-4-1,2371471,encoding,2.72293,0.47619,0.199762,0.101519,21,10,False,0.334673,0.487873,22,8,30,30,1.0,0.375526,1.0,6244.0,2.0,2.0,What stunt is one motorcyclist performing?,1.0,5281.0,3.0,3.0,What is nearest to the motorcyclists?,42.0,2.0,,,,
Encode-Decode_Experiment-4-1,2350974,encoding,2.777198,0.833333,0.464611,0.132768,18,15,False,0.265747,0.129336,29,1,32,30,0.9375,0.256541,1.0,2861.0,1.0,1.0,What is the child up against?,1.0,5144.0,4.0,4.0,Between which two objects is the child standing?,49.0,2.0,,,,
Encode-Decode_Experiment-4-1,150472,encoding,-0.564194,0.185185,0.234259,0.086981,27,5,False,0.087298,0.061032,10,24,34,34,1.0,0.068757,1.0,2838.0,2.0,2.0,Where is the pizza slice located?,1.0,2955.0,4.0,4.0,How many women are in the scene?,54.0,2.0,,,,
Encode-Decode_Experiment-4-1,2371471,decoding,,1.0,1.0,0.0,9,9,False,0.131041,,20,0,20,20,1.0,0.131041,,,,,,,,,,,,,two men riding motorcycles one of them was doing a handstand on the bike and the other was sitting down they were in a warehouse and there was a dirt ramp in view the man doing the handstand was to the right of the man sitting down,60180.0,1.0,Which description best matches the image?
Encode-Decode_Experiment-4-1,2385851,decoding,1.113651,0.2,0.065,0.121223,5,1,False,0.029029,0.169111,5,10,15,15,1.0,0.122417,,,,,,,,,,,,,"to men carrying red suitcases on their backs, walking through a covered shelter away from the screen",33790.0,2.0,Which description best matches the image?
Encode-Decode_Experiment-4-1,2394020,decoding,-0.04559,0.5,0.510833,0.237626,6,3,False,0.219693,0.181732,8,1,9,9,1.0,0.215475,,,,,,,,,,,,,"two men riding black white and brown horses along a beach, riding from my perspective to the right and both wearing cowboy hats and shirts/jeans",44416.0,3.0,Which description best matches the image?
Encode-Decode_Experiment-4-1,2369373,decoding,0.336585,0.727273,0.671182,0.166647,11,8,False,0.140591,0.289597,15,2,17,17,1.0,0.158121,,,,,,,,,,,,,man in white chef outfit and hat using a pizza paddle to put a pizza into pizza oven. oven looked like an open mout and was made of stone. fire inside oven,40345.0,4.0,Which description best matches the image?
Encode-Decode_Experiment-4-1,2412687,decoding,,0.0,0.0,0.0,1,0,True,,0.042407,0,13,14,13,0.9286,0.047213,,,,,,,,,,,,,"man in a grey outfit playing with a golden retriver dog in a garden, appeared to be nighttime. man i holding a red frisbee and standing to the right on the dog",41493.0,5.0,Which description best matches the image?
Encode-Decode_Experiment-4-1,2344622,decoding,0.418066,0.25,0.163,0.208101,4,1,False,0.089393,0.204469,3,15,19,18,0.9474,0.189899,,,,,,,,,,,,,cat lying on a b;ue blamket to the left of a key board where a womens hand is lying. woman has long nails,36588.0,6.0,Which description best matches the image?
Encode-Decode_Experiment-4-1,2360001,decoding,1.237536,0.272727,0.129273,0.115919,11,3,False,0.213268,0.204962,6,10,16,16,1.0,0.208077,,,,,,,,,,,,,,40965.0,7.0,Which description best matches the image?
Encode-Decode_Experiment-4-1,2411268,decoding,1.833406,0.928571,0.661929,0.145436,14,13,False,0.066589,,20,0,20,20,1.0,0.066589,,,,,,,,,,,,,child in garden picking green apples from a tree. the child is holding a red bag in left hand and reaches up with other hand there is another child in the background to the left (from my perspective),48952.0,8.0,Which description best matches the image?
Encode-Decode_Experiment-4-1,2370664,decoding,,,,,0,0,True,,0.121845,0,7,9,7,0.7778,0.140115,,,,,,,,,,,,,,18507.0,9.0,Which description best matches the image?
Encode-Decode_Experiment-4-1,2347400,decoding,,0.0,0.0,0.0,5,0,False,,0.0877,0,9,13,9,0.6923,0.090873,,,,,,,,,,,,,"two men sat on a sofa are smelling red wine, one has a blue shirt with a face on it and the other is wearing grey, men have short hair",49913.0,10.0,Which description best matches the image?
Encode-Decode_Experiment-4-1,2410309,decoding,1.815878,0.666667,0.331667,0.184484,9,6,False,0.133473,0.05668,11,3,14,14,1.0,0.117017,,,,,,,,,,,,,,29422.0,11.0,Which description best matches the image?
Encode-Decode_Experiment-4-1,2374670,decoding,1.638642,0.7,0.4072,0.178685,10,7,False,0.169245,0.591138,14,1,15,15,1.0,0.197371,,,,,,,,,,,,,a man is standing on the back of a red truck which is spraying water from the bottom. the red truck appears to be driving down street and the mans back is facing screen. the truck has a green hose on it. man stands on left side of back of truck,71005.0,12.0,Which description best matches the image?
Encode-Decode_Experiment-4-1,2383555,decoding,0.016569,0.166667,0.163833,0.171003,6,1,False,0.128513,0.133208,5,10,15,15,1.0,0.131643,,,,,,,,,,,,,"three women and a baby are in a raft through a stream. the child is at the fron of the boat amd the woman behind is holding on to him, she wears a hat",53022.0,13.0,Which description best matches the image?
Encode-Decode_Experiment-4-1,2350974,decoding,0.243574,0.4,0.339,0.250438,5,2,False,0.086012,0.090728,14,4,18,18,1.0,0.08706,,,,,,,,,,,,,"a child drinks from a nearly emtpy bottle of coke as he leans on a red car. he is between the red car and a blue motorbike, he has short brown hair",32983.0,14.0,Which description best matches the image?
Encode-Decode_Experiment-4-1,2367132,decoding,0.014453,0.333333,0.330667,0.184505,9,3,False,0.042967,0.052,12,5,17,17,1.0,0.045624,,,,,,,,,,,,,"two men play wii im living room setting. they both hold on to a controller in each hand, there is a girl in the background sitting on a brown/beige sofa",44274.0,15.0,Which description best matches the image?
Encode-Decode_Experiment-4-1,2408717,decoding,,0.0,0.0,0.0,3,0,False,,0.091523,0,12,13,12,0.9231,0.084928,,,,,,,,,,,,,four women in wetsuits carry surfboards towards the sea. the two women to the right of the screen carrying blue/ turquoise surdfboards and the other two woemne carry mostly white surfboards,45680.0,16.0,Which description best matches the image?
Encode-Decode_Experiment-4-1,2379478,decoding,-0.840269,0.25,0.5005,0.298119,4,1,False,0.334278,0.632735,2,3,6,5,0.8333,0.446368,,,,,,,,,,,,,,27368.0,17.0,Which description best matches the image?
Encode-Decode_Experiment-4-1,2356125,decoding,0.502542,0.666667,0.491667,0.34823,3,2,False,0.140206,0.04041,3,15,18,18,1.0,0.057042,,,,,,,,,,,,,,5787.0,18.0,Which description best matches the image?
Encode-Decode_Experiment-4-1,2385550,decoding,,1.0,1.0,0.0,1,1,True,0.875462,,19,0,19,19,1.0,0.875462,,,,,,,,,,,,,"two children a girl and a boy have tangerine piece in their mouths. the girl is on the rught side and has a fringe, they both have brown eyes",42164.0,19.0,Which description best matches the image?
Encode-Decode_Experiment-4-1,2348899,decoding,0.938811,0.714286,0.507143,0.220644,7,5,False,0.165998,,21,0,22,21,0.9545,0.164233,,,,,,,,,,,,,"a man sitting down has a tie on and another tie thats pink and stripey around his neck. a women is standing over him to the right and is touchin ghte tie, two men are sitting to the left of him and one is wearing a black and white stripey shirt",59960.0,20.0,Which description best matches the image?
Encode-Decode_Experiment-4-1,2409918,decoding,-0.606278,0.375,0.501875,0.209269,8,3,False,0.054342,0.095931,4,9,13,13,1.0,0.083134,,,,,,,,,,,,,two men are on top of two elephants in a stream. on the left the man sits on the eleohant and on the right the man stands. the elephants are eating,48299.0,21.0,Which description best matches the image?
Encode-Decode_Experiment-4-1,2387122,decoding,,,,,0,0,True,,0.12335,0,17,21,17,0.8095,0.135519,,,,,,,,,,,,,a blonde short haired woman is taking photographs of a polar bear which is opposite to her in water. the polar bear has its paws pressedup against the glass enclosure that it sits in,58112.0,22.0,Which description best matches the image?
Encode-Decode_Experiment-4-1,2362704,decoding,0.350905,0.25,0.1755,0.212308,4,1,False,0.06512,0.141824,2,9,11,11,1.0,0.127878,,,,,,,,,,,,,two black bears sit on the ground eating two pumpkins which are torn apart,27621.0,23.0,Which description best matches the image?
Encode-Decode_Experiment-4-1,150472,decoding,0.682714,0.333333,0.206,0.186511,6,2,False,0.098183,0.169382,5,12,17,17,1.0,0.148441,,,,,,,,,,,,,chef in white uniform and chef hat uses pizza paddle to put pizza into oven. the pizza ove is made from stone and looks like a large open mouth. there is fire seen inside the oven,51631.0,24.0,Which description best matches the image?
Encode-Decode_Experiment-4-1,2356991,decoding,,0.0,0.0,0.0,4,0,False,,0.061716,0,24,24,24,1.0,0.061716,,,,,,,,,,,,,a man dives head first towards a base whilst the other appears to be trying to catch him out. one of the men is wearing a glove. uniforms are white and red. the man catching the other out is standing upright,70295.0,25.0,Which description best matches the image?
Encode-Decode_Experiment-4-1,2397102,decoding,-0.535756,0.2,0.3294,0.241528,5,1,False,0.080684,0.065423,4,14,19,18,0.9474,0.065275,,,,,,,,,,,,,a woman and a man are cutting a cake together. he holds the knife with one hand and she holds it with two. she wears a red strapless dress and he holds a beer in his free hand in a brown bottle. the icing on the cake is red yellow and blue and white,61884.0,26.0,Which description best matches the image?
Encode-Decode_Experiment-4-1,2345035,decoding,,1.0,1.0,0.0,1,1,True,0.122809,,16,0,16,16,1.0,0.122809,,,,,,,,,,,,,two girls are chasing a football away from the screen. thereare other players on the footbacll pitch. the two girls chasing are numbers 20 and 3 and both have ling hair in ponytails,50913.0,27.0,Which description best matches the image?
Encode-Decode_Experiment-4-1,2347025,decoding,,1.0,1.0,0.0,8,8,False,0.106738,,17,0,19,17,0.8947,0.1061,,,,,,,,,,,,,a woman holds a small child on her back who is holding an umberella. the woman faces the camera directly and is smiling. the umberella is multicoloured and the child wears a raincoat,51590.0,28.0,Which description best matches the image?
Encode-Decode_Experiment-4-1,2349475,decoding,,0.0,0.0,0.0,5,0,False,,0.027336,0,20,20,20,1.0,0.027336,,,,,,,,,,,,,"there is a yellow looking drink inside of a large blender. a man peddles a bike which appears to be connected to the blender. a woman stands to the other side of the blender which is the right side. a man stands behind the blender in the background but his face cannot be seen. the man on the bike is looking at the camera and smiling, they are wearing sportswear",76752.0,29.0,Which description best matches the image?
Encode-Decode_Experiment-4-1,2386442,decoding,,,,,0,0,True,,0.055388,0,19,19,19,1.0,0.055388,,,,,,,,,,,,,"a woman man and ababy are all brushing their teeth. they all have bworn hair. the man wears a pink shirts and the baby a checkered one. the woman wears glasses, they all look directly towards the camera",40908.0,30.0,Which description best matches the image?
Encode-Decode_Experiment-5-1,2349475,encoding,0.197291,0.35,0.32465,0.128491,20,7,False,0.071668,0.058876,14,16,34,30,0.8824,0.08261,0.0,8172.0,2.0,1.0,What is the man doing to power the blender?,1.0,3660.0,3.0,3.0,Which part of the blender is the woman holding?,1.0,1.0,,,,
Encode-Decode_Experiment-5-1,2360001,encoding,0.680193,0.166667,0.124367,0.062188,30,5,False,0.24632,0.265574,12,25,37,37,1.0,0.259329,1.0,3813.0,4.0,4.0,What are the workers doing to the clock?,1.0,6089.0,4.0,4.0,Where are the men standing?,2.0,2.0,,,,
