SubjectID,StimID,Phase,svg_z_enc,svg_obs,svg_null_mean,svg_null_std,n_transitions,n_relational,low_n_enc,mean_salience_relational_enc,mean_salience_nonrelational,n_relational_fixations,n_nonrelational_fixations,n_fixations_enc,n_aoi,aoi_prop_enc,mean_salience_enc,enc_q1_accuracy,enc_q1_rt_ms,enc_q1_response,enc_q1_correct_key,enc_q1_question,enc_q2_accuracy,enc_q2_rt_ms,enc_q2_response,enc_q2_correct_key,enc_q2_question,enc_trial_index,enc_total_correct,dec_free_response,dec_rt_ms,dec_trial_index,dec_cue_question,prop_total,prop_relations,prop_objects,n_total_recalled,n_relations_recalled,n_objects_recalled,svg_z_enc_z,n_fixations_enc_z,aoi_prop_enc_z,mean_salience_relational_enc_z
Encode-Decode_Experiment-4-1,2349475,encoding,1.784405,0.230769,0.110885,0.067185,26,6,False,0.096272,0.04711,16,20,38,36,0.9474,0.073026,1.0,3326.0,3.0,3.0,Which part of the blender is the woman holding?,1.0,12925.0,1.0,1.0,What is the man doing to power the blender?,22.0,2.0,,,,,1.0,1.0,1.0,20.0,10.0,10.0,0.3265258904057368,0.735818933674695,0.4282625280113849,-1.1119190513491828
Encode-Decode_Experiment-4-1,2347025,encoding,2.164675,0.636364,0.380273,0.118305,22,14,False,0.102213,0.281211,26,3,34,29,0.8529,0.122783,1.0,4993.0,2.0,2.0,Who is holding the umbrella in the scene?,1.0,6543.0,1.0,1.0,Where is the baby in relation to the mother?,23.0,2.0,,,,,0.8666666666666667,1.0,0.75,13.0,4.0,9.0,0.5842679837828219,-0.027841797490394334,-0.60820476667163,-1.0431023150968401
Encode-Decode_Experiment-4-1,2360001,encoding,2.365592,0.28,0.11564,0.069479,25,7,False,0.252321,0.408376,13,18,32,31,0.9688,0.333617,1.0,4401.0,4.0,4.0,Where are the men standing?,1.0,5281.0,4.0,4.0,What are the workers doing to the clock?,25.0,2.0,,,,,0.0,0.0,0.0,0.0,0.0,0.0,0.7204469307811225,-0.40967216307293897,0.6629757566485964,0.695652548624191
Encode-Decode_Experiment-4-1,2370664,encoding,-1.074701,0.1,0.19835,0.091514,20,2,False,0.173354,0.144422,5,30,35,35,1.0,0.148556,1.0,4449.0,1.0,1.0,Where are the people located in the scene?,1.0,2957.0,4.0,4.0,How many donuts are in the scene?,26.0,2.0,,,,,0.0,0.0,0.0,0.0,0.0,0.0,-1.6113392202445496,0.163073385300878,1.0051744825121949,-0.21905056728874278
Encode-Decode_Experiment-4-1,2411268,encoding,1.712146,0.470588,0.251471,0.127978,17,8,False,0.167575,0.51752,17,8,32,25,0.7812,0.269349,1.0,5263.0,4.0,4.0,Where is the fruit branch relative to the child?,1.0,5133.0,2.0,2.0,What is the child holding while picking fruit?,27.0,2.0,,,,,0.8125,1.0,0.7,13.0,6.0,7.0,0.27754967370356515,-0.40967216307293897,-1.3946037616850917,-0.28599079937126903
Encode-Decode_Experiment-4-1,2387122,encoding,1.091198,0.35,0.2353,0.105114,20,7,False,0.170251,0.254234,14,8,25,22,0.88,0.19925,1.0,6511.0,1.0,1.0,What is the polar bear doing next to the enclosure edge?,1.0,3898.0,3.0,3.0,Where is the polar bear located in the scene?,30.0,2.0,,,,,0.8235294117647058,0.6,0.9166666666666666,14.0,3.0,11.0,-0.14332085880837184,-1.7460784426118452,-0.3109744631170299,-0.25499373049207874
Encode-Decode_Experiment-4-1,2344622,encoding,-0.040314,0.3,0.3045,0.111623,20,6,False,0.166072,0.263708,14,12,35,26,0.7429,0.246308,1.0,5850.0,2.0,2.0,Where is the cat located?,1.0,4554.0,4.0,4.0,What is the cat resting its head on?,31.0,2.0,,,,,0.7857142857142857,0.6,0.8888888888888888,11.0,3.0,8.0,-0.9102450746584055,0.163073385300878,-1.8146746334984194,-0.30340058805789943
Encode-Decode_Experiment-4-1,2408717,encoding,1.079566,0.217391,0.134478,0.076802,23,5,False,0.200659,0.253072,14,20,37,34,0.9189,0.232961,1.0,2687.0,2.0,2.0,How many surfers are in the scene?,0.0,3872.0,2.0,3.0,What are the surfers doing with the surfboards?,32.0,1.0,,,,,0.6,0.4,0.6666666666666666,9.0,2.0,6.0,-0.15120487813717037,0.5449037508834227,0.11567715342444433,0.09723305219791178
Encode-Decode_Experiment-4-1,2367132,encoding,5.367882,0.56,0.14324,0.07764,25,14,False,0.092799,0.063584,25,7,33,32,0.9697,0.086315,1.0,6597.0,4.0,4.0,In which hand(s) are the men holding the controllers?,1.0,3408.0,2.0,2.0,How many men are playing in the scene?,34.0,2.0,,,,,0.8235294117647058,0.8,0.75,14.0,4.0,9.0,2.7553603068693993,-0.21875698028166665,0.6728468737408158,-1.1521480574095069
Encode-Decode_Experiment-4-1,2348899,encoding,3.111831,0.571429,0.250143,0.103247,21,12,False,0.199881,0.141777,30,6,36,36,1.0,0.190197,0.0,6606.0,4.0,1.0,Where is the woman located relative to the man? (from your perspective),1.0,4062.0,4.0,4.0,What is the woman doing?,38.0,1.0,,,,,0.8260869565217391,0.8333333333333334,0.8235294117647058,19.0,5.0,14.0,1.2262380844867071,0.35398856809215035,1.0051744825121949,0.08822119883916366
Encode-Decode_Experiment-4-1,2356991,encoding,0.829642,0.259259,0.186037,0.088258,27,7,False,0.154902,0.112126,13,18,33,31,0.9394,0.136008,1.0,7111.0,2.0,2.0,What is the current action of the gloved player on the base?,1.0,8700.0,1.0,1.0,How is the player on the left (from your perspective) reaching the base?,40.0,2.0,,,,,0.7333333333333333,0.42857142857142855,0.8,11.0,3.0,8.0,-0.3206001366250202,-0.21875698028166665,0.3405192649694365,-0.4327867089026505
Encode-Decode_Experiment-4-1,2371471,encoding,2.661073,0.47619,0.197524,0.10472,21,10,False,0.334673,0.487873,22,8,30,30,1.0,0.375526,1.0,6244.0,2.0,2.0,What stunt is one motorcyclist performing?,1.0,5281.0,3.0,3.0,What is nearest to the motorcyclists?,42.0,2.0,,,,,0.5,0.4,0.4666666666666667,10.0,2.0,7.0,0.9207201353282983,-0.7915025286554837,1.0051744825121949,1.64956533499903
Encode-Decode_Experiment-4-1,2350974,encoding,2.599409,0.833333,0.471444,0.13922,18,15,False,0.265747,0.129336,29,1,32,30,0.9375,0.256541,1.0,2861.0,1.0,1.0,What is the child up against?,1.0,5144.0,4.0,4.0,Between which two objects is the child standing?,49.0,2.0,,,,,0.9166666666666666,0.75,0.8,11.0,3.0,8.0,0.8789250727516961,-0.40967216307293897,0.31968023999697365,0.8511707275374971
Encode-Decode_Experiment-4-1,150472,encoding,-0.569565,0.185185,0.236444,0.089997,27,5,False,0.087298,0.061032,10,24,34,34,1.0,0.068757,1.0,2838.0,2.0,2.0,Where is the pizza slice located?,1.0,2955.0,4.0,4.0,How many women are in the scene?,54.0,2.0,,,,,0.4375,0.0,0.7,7.0,0.0,7.0,-1.2689645651833372,-0.027841797490394334,1.0051744825121949,-1.2158681156697555
Encode-Decode_Experiment-5-1,2349475,encoding,0.244342,0.35,0.3194,0.125234,20,7,False,0.071668,0.058876,14,16,34,30,0.8824,0.08261,0.0,8172.0,2.0,1.0,What is the man doing to power the blender?,1.0,3660.0,3.0,3.0,Which part of the blender is the woman holding?,1.0,1.0,,,,,0.55,0.4,0.7,11.0,4.0,7.0,-0.7173089152654807,-0.027841797490394334,-0.2846514842044459,-1.3969160179798237
Encode-Decode_Experiment-5-1,2360001,encoding,0.722379,0.166667,0.122933,0.060541,30,5,False,0.24632,0.265574,12,25,37,37,1.0,0.259329,1.0,3813.0,4.0,4.0,What are the workers doing to the clock?,1.0,6089.0,4.0,4.0,Where are the men standing?,2.0,2.0,,,,,1.0,0.75,1.0,15.0,3.0,11.0,-0.39330161231835986,0.5449037508834227,1.0051744825121949,0.6261408108274719
Encode-Decode_Experiment-5-1,2348899,encoding,3.92437,0.541667,0.197625,0.087668,24,13,False,0.171048,0.131248,22,10,33,32,0.9697,0.156679,1.0,3413.0,4.0,4.0,What is the woman doing?,0.0,9968.0,4.0,1.0,Where is the woman located relative to the man? (from your perspective),3.0,1.0,,,,,0.6521739130434783,0.5,0.7058823529411765,15.0,3.0,12.0,1.7769665216774488,-0.21875698028166665,0.6728468737408158,-0.24576179331094483
Encode-Decode_Experiment-5-1,2410309,encoding,1.401268,0.269231,0.155538,0.081135,26,7,False,0.438931,0.174456,11,22,33,33,1.0,0.262614,0.0,2908.0,4.0,2.0,What is the baby touching?,1.0,4102.0,4.0,4.0,How many laptops or electronic devices are visible?,4.0,1.0,,,,,0.4666666666666667,0.2857142857142857,0.625,7.0,2.0,5.0,0.06684058146678215,-0.21875698028166665,1.0051744825121949,2.8572231852257155
Encode-Decode_Experiment-5-1,2345035,encoding,-0.055969,0.258065,0.26329,0.093369,31,8,False,0.181033,0.193408,14,19,38,33,0.8684,0.185014,1.0,6024.0,2.0,2.0,Who runs toward the football in the scene?,0.0,6124.0,4.0,3.0,What are the people doing with the football?,5.0,1.0,,,,,0.6190476190476191,0.6,0.6666666666666666,13.0,3.0,10.0,-0.9208558314149687,0.735818933674695,-0.4382021945278556,-0.13010195296762878
Encode-Decode_Experiment-5-1,2374670,encoding,2.197972,0.722222,0.429889,0.133001,18,13,False,0.233518,0.21339,26,3,30,29,0.9667,0.227883,0.0,5301.0,4.0,1.0,What vehicle sprays water in the scene?,0.0,13294.0,1.0,3.0,Where is the man standing relative to the vehicle?,6.0,0.0,,,,,0.42105263157894735,0.2857142857142857,0.5454545454545454,8.0,2.0,6.0,0.6068362602263405,-0.7915025286554837,0.6399431501000851,0.47785064797568083
Encode-Decode_Experiment-5-1,2367132,encoding,3.643609,0.5,0.164909,0.091967,22,11,False,0.091774,0.077465,25,8,35,33,0.9429,0.085645,1.0,4793.0,4.0,4.0,In which hand(s) are the men holding the controllers?,1.0,4182.0,2.0,2.0,How many men are playing in the scene?,7.0,2.0,,,,,0.5882352941176471,0.6,0.5,10.0,3.0,6.0,1.586670342965892,0.163073385300878,0.37890694255028834,-1.1640210004592715
Encode-Decode_Experiment-5-1,150472,encoding,-0.260097,0.25,0.275333,0.0974,24,6,False,0.078941,0.072435,11,21,34,32,0.9412,0.081712,1.0,3198.0,4.0,4.0,How many women are in the scene?,1.0,2794.0,2.0,2.0,Where is the pizza slice located?,9.0,2.0,,,,,0.625,1.0,0.6,10.0,4.0,6.0,-1.0592111527310801,-0.027841797490394334,0.3602614991538752,-1.3126702474423237
Encode-Decode_Experiment-5-1,2347025,encoding,1.434066,0.8,0.596533,0.141881,15,12,False,0.138777,0.154743,24,2,29,26,0.8966,0.14315,1.0,4566.0,1.0,1.0,Where is the baby in relation to the mother?,1.0,3624.0,2.0,2.0,Who is holding the umbrella in the scene?,10.0,2.0,,,,,1.0,1.0,0.9166666666666666,15.0,4.0,11.0,0.08907064215676996,-0.9824177114467559,-0.1289071923049877,-0.6195683739538245
Encode-Decode_Experiment-5-1,2344622,encoding,1.341235,0.318182,0.197091,0.090283,22,7,False,0.256205,0.218313,12,18,33,30,0.9091,0.240572,1.0,3927.0,4.0,4.0,What is the cat resting its head on?,1.0,4099.0,2.0,2.0,Where is the cat located?,11.0,2.0,,,,,0.7142857142857143,0.6,0.7777777777777778,10.0,3.0,7.0,0.02615098961965628,-0.21875698028166665,0.008191656198057286,0.740642315263494
Encode-Decode_Experiment-5-1,2408717,encoding,0.302458,0.24,0.21328,0.088343,25,6,False,0.269356,0.246612,10,19,32,29,0.9062,0.250411,1.0,3377.0,2.0,2.0,How many surfers are in the scene?,1.0,4399.0,3.0,3.0,What are the surfers doing with the surfboards?,12.0,2.0,,,,,0.7333333333333333,0.6,0.6666666666666666,11.0,3.0,6.0,-0.6779186412530614,-0.40967216307293897,-0.023615276654649135,0.892975070431741
Encode-Decode_Experiment-5-1,2356991,encoding,0.359399,0.24,0.20384,0.100612,25,6,False,0.194722,0.129511,10,21,32,31,0.9688,0.148026,0.0,6258.0,3.0,2.0,What is the current action of the gloved player on the base?,0.0,11878.0,3.0,1.0,How is the player on the left (from your perspective) reaching the base?,13.0,0.0,,,,,0.4666666666666667,0.14285714285714285,0.5,7.0,1.0,5.0,-0.6393247670610804,-0.40967216307293897,0.6629757566485964,0.028462649381860963
Encode-Decode_Experiment-5-1,2362704,encoding,0.217305,0.130435,0.114174,0.07483,23,3,False,0.158444,0.176088,11,22,33,33,1.0,0.170206,1.0,3687.0,4.0,4.0,What are the bears doing with the pumpkins?,1.0,1893.0,2.0,2.0,How many bears are in the scene?,14.0,2.0,,,,,0.6666666666666666,0.2,0.7142857142857143,6.0,1.0,5.0,-0.7356342445805364,-0.21875698028166665,1.0051744825121949,-0.39175845106629353
Encode-Decode_Experiment-5-1,2385851,encoding,1.299278,0.185185,0.102889,0.06334,27,5,False,0.117609,0.142163,9,21,30,30,1.0,0.134796,1.0,3307.0,2.0,2.0,What are the men doing with the suitcases?,0.0,5379.0,4.0,3.0,Where are the men?,15.0,1.0,,,,,0.9285714285714286,0.8,1.0,13.0,4.0,9.0,-0.002286922947262927,-0.7915025286554837,1.0051744825121949,-0.8647649188098402
Encode-Decode_Experiment-5-1,2370664,encoding,1.191137,0.333333,0.2036,0.108916,15,5,False,0.125303,0.116319,11,18,29,29,1.0,0.119727,1.0,2450.0,4.0,4.0,How many donuts are in the scene?,1.0,3950.0,1.0,1.0,Where are the people located in the scene?,17.0,2.0,,,,,1.0,1.0,0.8333333333333334,17.0,7.0,10.0,-0.07558349569791739,-0.9824177114467559,1.0051744825121949,-0.7756425541026319
Encode-Decode_Experiment-5-1,2356125,encoding,0.762135,0.291667,0.22225,0.091082,24,7,False,0.2978,0.279039,14,15,32,29,0.9062,0.289429,0.0,11198.0,3.0,1.0,Where is the luggage being moved to?,1.0,3117.0,2.0,2.0,How many uniformed staff are moving the luggage?,18.0,1.0,,,,,0.75,0.42857142857142855,0.9230769230769231,15.0,3.0,12.0,-0.3663555091172149,-0.40967216307293897,-0.023615276654649135,1.2224521359024758
Encode-Decode_Experiment-5-1,2386442,encoding,1.533104,0.631579,0.426947,0.133475,19,12,False,0.13802,0.08192,29,4,33,33,1.0,0.13122,1.0,7533.0,1.0,1.0,Who is brushing their teeth in the scene?,1.0,5414.0,3.0,3.0,What is the person on the right wearing?,19.0,2.0,,,,,0.7647058823529411,1.0,0.5384615384615384,13.0,6.0,7.0,0.15619731910704146,-0.21875698028166665,1.0051744825121949,-0.6283369767720409
Encode-Decode_Experiment-5-1,2371471,encoding,4.246587,0.611111,0.179,0.101755,18,11,False,0.306674,0.484853,23,7,30,30,1.0,0.34825,1.0,10200.0,3.0,3.0,What is nearest to the motorcyclists?,1.0,8912.0,2.0,2.0,What stunt is one motorcyclist performing?,20.0,2.0,,,,,1.0,0.8,1.0,20.0,4.0,15.0,1.9953610416282321,-0.7915025286554837,1.0051744825121949,1.3252428643157543
Encode-Decode_Experiment-5-1,2385550,encoding,3.876536,0.545455,0.1955,0.090275,22,12,False,0.248635,0.238666,21,7,31,28,0.9032,0.273435,1.0,3058.0,4.0,4.0,Where are the tangerines in the scene?,1.0,6850.0,3.0,3.0,Which side of the frame is the boy on? (from your perspective),23.0,2.0,,,,,0.4666666666666667,0.0,0.5833333333333334,7.0,0.0,7.0,1.7445452544341757,-0.6005873458642114,-0.05651900029537978,0.6529562870813302
Encode-Decode_Experiment-5-1,2350974,encoding,2.422634,0.409091,0.179091,0.094938,22,9,False,0.280042,0.223444,15,13,31,28,0.9032,0.254555,0.0,3514.0,1.0,4.0,Between which two objects is the child standing?,1.0,3277.0,1.0,1.0,What is the child up against?,25.0,1.0,,,,,0.9166666666666666,1.0,0.7,11.0,4.0,7.0,0.7591092614683073,-0.6005873458642114,-0.05651900029537978,1.0167548454851891
Encode-Decode_Experiment-5-1,2369373,encoding,0.938807,0.461538,0.3575,0.11082,26,12,False,0.247649,0.24605,20,13,33,33,1.0,0.247019,1.0,7750.0,3.0,3.0,What is the appearance of the oven?,1.0,3747.0,3.0,3.0,What tool is the chef using?,26.0,2.0,,,,,0.8,1.0,0.75,12.0,3.0,9.0,-0.24660950990319228,-0.21875698028166665,1.0051744825121949,0.6415350950354105
Encode-Decode_Experiment-5-1,2409918,encoding,3.484263,0.764706,0.322471,0.126924,17,13,False,0.144493,,28,0,32,28,0.875,0.147515,1.0,5272.0,2.0,2.0,What is the elephant on the right (from your perspective) doing with its trunk?,1.0,4649.0,4.0,4.0,Where are the elephants in the scene?,27.0,2.0,,,,,0.625,0.5,0.6,10.0,3.0,6.0,1.4786676827211578,-0.40967216307293897,-0.3658140025182477,-0.5533578934928937
Encode-Decode_Experiment-5-1,2411268,encoding,3.064056,0.588235,0.224059,0.118854,17,10,False,0.205766,0.23027,21,5,31,26,0.8387,0.217167,1.0,5381.0,2.0,2.0,What is the child holding while picking fruit?,0.0,8047.0,3.0,4.0,Where is the fruit branch relative to the child?,28.0,1.0,,,,,0.6875,0.3333333333333333,0.9,11.0,2.0,9.0,1.193856806681226,-0.6005873458642114,-0.7639490585710882,0.1563892669834216
Encode-Decode_Experiment-5-1,2412687,encoding,1.843859,0.526316,0.310474,0.11706,19,10,False,0.147877,0.192436,18,9,30,27,0.9,0.155201,1.0,5392.0,3.0,3.0,What is the human's body position?,1.0,7321.0,4.0,4.0,What is the dog biting onto in the scene?,30.0,2.0,,,,,0.4666666666666667,0.25,0.5555555555555556,7.0,1.0,5.0,0.36682304353283385,-0.7915025286554837,-0.09161630551215891,-0.5141598063900612
Encode-Decode_Experiment-5-1,2383555,encoding,0.317252,0.142857,0.116667,0.082554,21,3,False,0.223844,0.158884,6,23,33,29,0.8788,0.171518,0.0,3792.0,3.0,2.0,Who is holding the child in the boat?,1.0,3054.0,4.0,4.0,What is the woman at the back doing in the boat?,31.0,1.0,,,,,0.8888888888888888,0.8333333333333334,1.0,16.0,5.0,11.0,-0.6678914591734322,-0.21875698028166665,-0.32413595257332195,0.3657932323040492
Encode-Decode_Experiment-5-1,2397102,encoding,2.248196,0.444444,0.204889,0.106555,18,8,False,0.097657,0.105357,19,8,27,27,1.0,0.099939,1.0,4137.0,1.0,1.0,What are the couple doing with the cake?,1.0,5111.0,3.0,3.0,What is the man holding besides the cake knife?,33.0,2.0,,,,,0.6666666666666666,0.4,0.631578947368421,14.0,2.0,12.0,0.6408774385937392,-1.3642480770293006,1.0051744825121949,-1.0958760990331595
Encode-Decode_Experiment-5-1,2394020,encoding,1.138752,0.714286,0.577571,0.120056,21,15,False,0.292191,0.523547,27,2,35,29,0.8286,0.314237,1.0,7965.0,1.0,1.0,Where is the scene taking place?,1.0,3672.0,2.0,2.0,What are the riders wearing on their heads?,37.0,2.0,,,,,1.0,0.6666666666666666,1.0,12.0,2.0,9.0,-0.11108937194784135,0.163073385300878,-0.874724928161548,1.1574810748623492
Encode-Decode_Experiment-5-1,2379478,encoding,2.128342,0.555556,0.289222,0.125137,18,10,False,0.396309,0.311159,21,5,31,26,0.8387,0.439666,1.0,2238.0,2.0,2.0,How many babies are visible in the scene?,1.0,4225.0,4.0,4.0,What is the position of the babies?,38.0,2.0,,,,,0.8461538461538461,0.4,0.9,11.0,2.0,9.0,0.559641945760707,-0.6005873458642114,-0.7639490585710882,2.3635172548188232
Encode-Decode_Experiment-5-1,2387122,encoding,0.802324,0.565217,0.469348,0.11949,23,13,False,0.109313,0.317383,21,6,28,27,0.9643,0.153336,1.0,6753.0,1.0,1.0,What is the polar bear doing next to the enclosure edge?,1.0,4290.0,3.0,3.0,Where is the polar bear located in the scene?,46.0,2.0,,,,,0.8235294117647058,0.8,0.8333333333333334,14.0,4.0,10.0,-0.3391159241098998,-1.1733328942380283,0.613620171187501,-0.960860465678959
Encode-Decode_Experiment-5-1,2347400,encoding,-0.918279,0.076923,0.181615,0.114009,13,1,False,0.109855,0.206783,2,22,26,24,0.9231,0.202065,1.0,2878.0,1.0,1.0,What are the men sitting on in the scene?,1.0,5821.0,3.0,3.0,What are the men doing with the wine?,56.0,2.0,,,,,1.0,1.0,1.0,20.0,8.0,12.0,-1.5053184094253147,-1.555163259820573,0.161742366521467,-0.954582285061425
Encode-Decode_Experiment-6-1,2362704,encoding,-1.274439,0.05,0.1671,0.091884,20,1,False,0.08172,0.199047,2,27,29,29,1.0,0.190956,1.0,3923.0,2.0,2.0,How many bears are in the scene?,1.0,3876.0,4.0,4.0,What are the bears doing with the pumpkins?,1.0,2.0,,,,,0.6666666666666666,0.4,0.5714285714285714,6.0,2.0,4.0,-1.746719056274087,-0.9824177114467559,1.0051744825121949,-1.2804800925786206
Encode-Decode_Experiment-6-1,2371471,encoding,-0.18501,0.318182,0.339591,0.115719,22,7,False,0.361373,0.563116,17,15,32,32,1.0,0.45594,1.0,8493.0,3.0,3.0,What is nearest to the motorcyclists?,1.0,10256.0,2.0,2.0,What stunt is one motorcyclist performing?,2.0,2.0,,,,,0.45,0.2,0.4666666666666667,9.0,1.0,7.0,-1.0083181541632067,-0.40967216307293897,1.0051744825121949,1.9588410222465553
Encode-Decode_Experiment-6-1,2360001,encoding,0.079594,0.16,0.15416,0.073372,25,4,False,0.426927,0.215679,6,25,32,31,0.9688,0.271626,1.0,8018.0,4.0,4.0,Where are the men standing?,1.0,6842.0,4.0,4.0,What are the workers doing to the clock?,3.0,2.0,,,,,0.6666666666666666,0.5,0.7272727272727273,10.0,2.0,8.0,-0.8289729813229874,-0.40967216307293897,0.6629757566485964,2.718176542914131
Encode-Decode_Experiment-6-1,2383555,encoding,1.261328,0.185185,0.105593,0.063102,27,5,False,0.193372,0.190928,10,23,34,33,0.9706,0.20003,1.0,5774.0,2.0,2.0,Who is holding the child in the boat?,1.0,4611.0,4.0,4.0,What is the woman at the back doing in the boat?,5.0,2.0,,,,,0.6666666666666666,0.6666666666666666,0.6363636363636364,12.0,4.0,7.0,-0.02800894267971714,-0.027841797490394334,0.6827179908330351,0.012825114633390373
Encode-Decode_Experiment-6-1,2347025,encoding,1.915729,0.7,0.46135,0.124574,20,14,False,0.123729,0.057568,32,1,33,33,1.0,0.121724,1.0,2759.0,2.0,2.0,Who is holding the umbrella in the scene?,1.0,4820.0,1.0,1.0,Where is the baby in relation to the mother?,6.0,2.0,,,,,0.6666666666666666,0.75,0.5833333333333334,10.0,3.0,7.0,0.4155356010604093,-0.21875698028166665,1.0051744825121949,-0.793874761283441
Encode-Decode_Experiment-6-1,2367132,encoding,4.908579,0.888889,0.265444,0.127011,18,16,False,0.112988,0.254916,31,1,33,32,0.9697,0.115855,1.0,2984.0,2.0,2.0,How many men are playing in the scene?,1.0,4237.0,4.0,4.0,In which hand(s) are the men holding the controllers?,7.0,2.0,,,,,0.8235294117647058,0.8,0.8333333333333334,14.0,4.0,10.0,2.4440506671019304,-0.21875698028166665,0.6728468737408158,-0.9182916210859006
Encode-Decode_Experiment-6-1,2349475,encoding,3.095436,0.3125,0.081937,0.074485,16,5,False,0.075718,0.042172,18,11,34,29,0.8529,0.08036,1.0,10831.0,3.0,3.0,Which part of the blender is the woman holding?,1.0,6520.0,1.0,1.0,What is the man doing to power the blender?,8.0,2.0,,,,,0.45,0.3,0.6,9.0,3.0,6.0,1.215125765290038,-0.027841797490394334,-0.60820476667163,-1.3500034137344126
Encode-Decode_Experiment-6-1,2344622,encoding,0.866905,0.5,0.391375,0.125302,16,8,False,0.172708,0.171239,22,9,37,31,0.8378,0.173965,1.0,3798.0,4.0,4.0,What is the cat resting its head on?,1.0,5496.0,2.0,2.0,Where is the cat located?,9.0,2.0,,,,,0.5714285714285714,0.6,0.5555555555555556,8.0,3.0,5.0,-0.29534375661736684,0.5449037508834227,-0.7738201756633075,-0.22653341724986278
Encode-Decode_Experiment-6-1,2374670,encoding,1.553777,0.521739,0.352652,0.108823,23,12,False,0.197009,0.20634,22,9,32,31,0.9688,0.198687,1.0,5062.0,1.0,1.0,What vehicle sprays water in the scene?,0.0,11085.0,4.0,3.0,Where is the man standing relative to the vehicle?,10.0,1.0,,,,,0.3684210526315789,0.42857142857142855,0.36363636363636365,7.0,3.0,4.0,0.17020921143718706,-0.40967216307293897,0.6629757566485964,0.05495379158167689
Encode-Decode_Experiment-6-1,2370664,encoding,1.418182,0.333333,0.194167,0.09813,18,6,False,0.137711,0.183272,15,20,35,35,1.0,0.163746,1.0,5787.0,1.0,1.0,Where are the people located in the scene?,1.0,4142.0,4.0,4.0,How many donuts are in the scene?,11.0,2.0,,,,,0.35294117647058826,0.14285714285714285,0.3333333333333333,6.0,1.0,4.0,0.0783046721586065,0.163073385300878,1.0051744825121949,-0.6319162347255798
Encode-Decode_Experiment-6-1,2385851,encoding,-1.124104,0.08,0.17584,0.085259,25,2,False,0.140113,0.199343,4,28,32,32,1.0,0.19194,1.0,4803.0,2.0,2.0,What are the men doing with the suitcases?,0.0,10605.0,1.0,3.0,Where are the men?,12.0,1.0,,,,,0.6428571428571429,0.4,0.7777777777777778,9.0,2.0,7.0,-1.6448239354182632,-0.40967216307293897,1.0051744825121949,-0.6040930062323756
Encode-Decode_Experiment-6-1,2385550,encoding,2.043467,0.26087,0.113609,0.072064,23,6,False,0.201581,0.286062,12,17,29,29,1.0,0.251104,1.0,3899.0,4.0,4.0,Where are the tangerines in the scene?,1.0,9415.0,3.0,3.0,Which side of the frame is the boy on? (from your perspective),13.0,2.0,,,,,0.9333333333333333,0.6666666666666666,1.0,14.0,2.0,12.0,0.5021147672418124,-0.9824177114467559,1.0051744825121949,0.10791290926316348
Encode-Decode_Experiment-6-1,2348899,encoding,4.707826,0.75,0.281,0.099621,24,18,False,0.185914,0.061976,34,1,35,35,1.0,0.182372,0.0,11975.0,4.0,1.0,Where is the woman located relative to the man? (from your perspective),1.0,5300.0,4.0,4.0,What is the woman doing?,14.0,1.0,,,,,0.6956521739130435,0.6666666666666666,0.7058823529411765,16.0,4.0,12.0,2.3079828771849504,0.163073385300878,1.0051744825121949,-0.07356357733260369
Encode-Decode_Experiment-6-1,2412687,encoding,1.019623,0.466667,0.328933,0.135083,15,7,False,0.132111,0.231921,17,10,30,27,0.9,0.16231,1.0,4024.0,4.0,4.0,What is the dog biting onto in the scene?,0.0,11397.0,2.0,3.0,What is the human's body position?,15.0,1.0,,,,,0.06666666666666667,0.0,0.1111111111111111,1.0,0.0,1.0,-0.19183346914698612,-0.7915025286554837,-0.09161630551215891,-0.6967830455340495
Encode-Decode_Experiment-6-1,2410309,encoding,0.198074,0.263158,0.240579,0.113993,19,5,False,0.186108,0.282301,10,18,28,28,1.0,0.247946,0.0,8622.0,1.0,2.0,What is the baby touching?,1.0,4545.0,4.0,4.0,How many laptops or electronic devices are visible?,16.0,1.0,,,,,0.6666666666666666,0.5714285714285714,0.75,10.0,4.0,6.0,-0.748668767939557,-1.1733328942380283,1.0051744825121949,-0.07131640567245313
Encode-Decode_Experiment-6-1,2369373,encoding,0.640421,0.434783,0.361435,0.114531,23,10,False,0.232185,0.29793,21,9,31,30,0.9677,0.247005,1.0,3541.0,3.0,3.0,What tool is the chef using?,1.0,9842.0,3.0,3.0,What is the appearance of the oven?,17.0,2.0,,,,,0.4,0.6666666666666666,0.3333333333333333,6.0,2.0,4.0,-0.4488516859213239,-0.6005873458642114,0.6509110579803287,0.46241003033145045
Encode-Decode_Experiment-6-1,2379478,encoding,1.985478,0.428571,0.222048,0.104017,21,9,False,0.374159,0.346301,17,12,32,29,0.9062,0.400067,1.0,6503.0,2.0,2.0,How many babies are visible in the scene?,1.0,4221.0,4.0,4.0,What is the position of the babies?,18.0,2.0,,,,,1.0,0.6,1.0,13.0,3.0,10.0,0.4628105721887085,-0.40967216307293897,-0.023615276654649135,2.1069458513531796
Encode-Decode_Experiment-6-1,150472,encoding,0.390529,0.36,0.31748,0.108878,25,9,False,0.099499,0.084864,15,19,34,34,1.0,0.091321,1.0,4454.0,2.0,2.0,Where is the pizza slice located?,1.0,3221.0,4.0,4.0,How many women are in the scene?,20.0,2.0,,,,,0.5625,0.5,0.7,9.0,2.0,7.0,-0.6182252552225744,-0.027841797490394334,1.0051744825121949,-1.074539551620802
Encode-Decode_Experiment-6-1,2347400,encoding,2.182152,0.421053,0.196789,0.102772,19,8,False,0.164823,0.200077,17,12,33,29,0.8788,0.192583,1.0,3524.0,1.0,1.0,What are the men sitting on in the scene?,1.0,2808.0,3.0,3.0,What are the men doing with the wine?,21.0,2.0,,,,,0.4,0.25,0.5,8.0,2.0,6.0,0.5961136686013753,-0.21875698028166665,-0.32413595257332195,-0.3178682035400028
